src,tgt,path
turn hallway.stop near plant,Turn around and go down the hallway.stop near the plant. ,"['57aa6e04ceb34e878125793bc9074a44', 'a175a4458f874819865d2496ddee330d', '9f6b4ff63cb04d92a06d25bc618de1a3', '3892d409b66644439f5afcf3d296efbf', '9affa8b685294bf1b15cc7538b035088']"
continue staircase through doorway on right straight hallway once in front of white rug,"Continue walking up the staircase, and through the doorway on the right. Walk straight down the hallway and stop once in front of the white rug. ","['a74b9199d22447118e506cfa169638e3', '2d20ebd11b9d4855bac237d15181e126', 'c688725841444971ab4788b382c60643', 'add739ed237b4b1ab540290617cdb30d', 'cc15fb105d86466faafdd633f89148de', '2c16cbd610cf4e1b92b2830f51c07e32', 'd7044641458e49b0803e186bd1856994']"
walk towards living room through living room on wooden area just outside sliding windows,Walk towards the living room. Continue through the living room and stop on the wooden area just outside the sliding windows. ,"['0e5f1cd9a1cf46ecb2280d75dbb0a819', 'd9a69bc7b8a54a319a05f366120ef056', '522362613f6341389177c0c259455f38', '0c55a4a0877b46459d81c35ffeaa34c0', '69ef6a026c7b41529a76364b0577703d']"
walk past palm tree into building stop in front of couch,Walk past the palm tree and into the building. Stop in front of the couch. ,"['4d70b3f12bd4440790211dc6fcd42831', '0fe870549d414f768cc3d8f76959bcad', 'ee5e9cb296834e2cb80028e1cc9e9fe9', '49760331a01d4d33b496b72968035e40', '2b620a64437e43a187c18892ac8fc0e9', '47987e2ccb6c45d497c7b5619d9194a0']"
up stairs turn outside by gate,Walk up the stairs and turn left. Walk outside and stop by the gate. ,"['ad3a2912de974a5690af5050e6ade942', 'af2982c371134df79520b348071775a0', '49913376d9ab471a8fce92a8edc786b9', '6c7301f898ff4b4c9d915dfbe887d507', 'f7a2350f36174c5e80dce2d3b77fb777']"
exit bathroom door on right bedroom across hall enter on left beside recliner,Exit the bathroom. Take the door on the right to exit the bedroom. Go across the hall. Enter on the left and stop beside the recliner. ,"['a59713eed44e47cca397462601c4d960', '7c9f57c094654e9a9cb27ae4a2f7fa0b', '92ffe9fa9ea6437c88eac23b0bafc0bc', '818d69716786445f8eef89a590ec3f52', '01b439d39a8f412fa1837be7afb45254']"
turn left doorway rockers at bottom of stairs stop,Turn around and go to the left. Enter the doorway to outside and pass the rockers. At the bottom of the stairs stop. ,"['77e6cfabf32d46fc9398ce824843adaa', 'ba19aada2e9a47839c0355085f70f7c5', '48a2541fc50b4a57a609698e2375e9b1', 'c9ac0c98d16a4105a3214989cac149c0', '7980b9f903164d48aaee2dbeb5615796', '9e3bb94fbf7f4dc0a74911414ca95753']"
exit bedroom through hallway right at stairs into bedroom wait in doorway,"Exit the bedroom, walk through the hallway and turn right at the stairs into the bedroom. Wait in the doorway. ","['521886391b7849c9b1e458e8e65760de', '2fdd7ac33e4e4e5ab38353ba6ab6cc7d', '69fad7dd177847dbabf69e8fb7c00ddf', 'c629c7f1cf6f47a78c45a8ae9ff82247', '21fca0d6192940e580587fe317440f56']"
walk past wine fridge on left right in front of round table down stairs right wait at bottom landing,Walk past the wine fridge on the left. Make a right in front of the round table. Walk down the stairs to the right. Wait at the bottom landing. ,"['f6a03fba4dfd415a8b65cce84ee21c19', 'd7f5f168d31547ce866159165b644da5', '27b26e3f29384e60944fc6151074b172', '0662f8da68b94d83a47af1e38f28f4e5', '9a503b8a42274ecc9c1fde72a893b75f', '2f211467f33544ff97c624d91f37e5fd', '47bac3dbc0914c429f447f98ee5c504d']"
walk by stairs enter door at end of hall,"walk by stairs, enter door at end of hall. ","['a7f591c0bf5443a8989e6adf9968cf90', 'a0a40af004954a90b2b24a0cc6655881', '24e8ebf554d742069e81afd7eb3369c7', '4214a9b1607e4cbea8dcdb42a4952796', '6127ee658ce64bf48765bf59bbead503', 'db8d7c22a6764639ab807ec3dec69a8b']"
down entire hallway inside of doorway zebra painting,Walk down the entire hallway and stop inside of the doorway facing a zebra painting. ,"['f1cc26867dcb44fda5f2e70555fe7856', '39274e52c0404a0a85a1705133468817', 'cc9907d0bebb4c78938322ea577af7cf', '4262bd54789f4caf839be008248e4d90', 'b2f31140a9d0482096da4ac481fb8a56', 'b09e4d4c48154b58914cf98dc3d8983a']"
from stairs hallway right into bedroom,"From stairs, walk down hallway turn right into bedroom. ","['f1b191033043441987b8ebf1bb55002c', 'c20f944e9c434804944b0c1251247202', '595ef74c51bb4448ae709297121d4c10', 'e4a543521c44412e8f264d083ac5fc0c', 'e3cf525579a04ab4b6a5cf3ea40f58f9']"
walk across room turn right then by striped rug,"Walk across the room, turn left, turn right, then turn left and wait by the striped rug. ","['52ca4f1175c846b0ab281ed9135b1040', '0965af34fada440a89bfb3700aa800c1', 'cffa1c807d2c4a708aa1e5f42aeba106', 'b09e4d4c48154b58914cf98dc3d8983a', '4bc28cee06d54af9aef263db6f9f2016', '8e9d71e0515e46d6a9b0d2e8dd1a50fc', 'd3864482f6bf42ada7aa0574b0f69f48']"
turn outside through patio doors,Turn left and walk outside through the patio doors. ,"['fdfeed5766974ae2bcd56e05a7de3117', 'ba5d70e6143e45c3a8281157ea9ed905', '871249bea9924fdba9937759ff5a22f4', 'c1dff12edb1e4cb0a1f5bc3b356dd4e2', '032a2df684fc4ac88dd6cd76e9552349']"
move towards kitchen before kitchen turn right path straight until dining table wait here,Move towards the kitchen.  Before you reach the kitchen turn right.  Follow this path straight until you reach a dining table.  Wait here. ,"['b5145233e4ab457ba0c31f9eb20307bf', 'a73871837379498eb16527c6b9c9aa20', 'c929b31b97a14f91b1cadb318a4a8353', 'd771d6746f274d4d90697765491f308e', 'ef592c66cb3e474c9a814c9973712487']"
exit room right right again into room next door wait at entrance,Exit the room. Turn right. Turn right again to go into the room next door. Wait at the entrance. ,"['8e649a3c097141978c621893e8b2ed9f', '22f85dac33524c6889f80fa7e76a6790', 'cf4babf2d24a44418351494fa1cb5ebf', '9224c582bc934d6ab146f7e624b0bab7', '5ca14589a7c4407b9333c3dc02d9c9a5']"
walk past tables hallway left wait by giant vase,Walk past the tables and go down the hallway to the left. Wait by the giant vase. ,"['114842471cc14a44b2f284c943281413', '4ebc0f4d023c482ca72e8129ca042c13', '83404d7a12fc4749bf0cfff1e1e07987', 'a31805b1b6dc4947a9cf22f16850a142', '183ac7f2f1eb4905bee16fbb5e4155bd']"
walk around bed toward balcony turn walk straight through door straight stop inside second doorway,Walk around the bed toward the balcony. Turn left and walk straight through the door. Go straight and stop inside the second doorway. ,"['74be0bce40ab4a599a7172c8bef59304', 'cb83ef7d8b3d4fd39d993c933438c127', 'a4d724f38115423284de93129331fdc7', '9297f6e3bbf646c19c811b380f5fbc55', '18940ca3b21745a8bd52557dc4b8abb3', '7b708eb6eca54256976220baf01508de', '050910e36ac9414c91bb44d962153689']"
bathroom right room stop at white planter,"Leave bathroom to hallway and turn right, Walk to living room and stop at white planter. ","['f174e6311c664bec80f0c38ae893cdc7', '23fb860d05574aa2b5ee29ffff796065', 'f29cfc331fc44746a060813f1e9ef52c', 'fa2cbbb20350430bb00b7039031111a7', '3a0f734a7b4e46c4bcee77b78c5e3f6a', 'cffa1c807d2c4a708aa1e5f42aeba106', '39136812de7e41b3a5e9fd431feca2c3']"
bathroom right in living room then left in living room walk dining room wait,Leave the bathroom and make a right to go in the living room. Then make a left in the living room and walk to the dining room and wait. ,"['181482379f144d5aa2cf726000d5adc8', '0b16234363974ebbb3089acf4f09d9be', '7ee437db8a914c6d8ce7555b3ce6aae4', '7bfd840693034959a2dffb2625026980', 'd2040fe496a245c3bae20b84ce63083a']"
turn slightly right past bed right wait in hallway with portrait items on wall,"Turn slightly right, walk past the bed. Turn right and wait in the hallway with portrait items on the wall. ","['1880ed0a5e3144739cd5fcaacf3b4dfd', '40bd5db3c01e445d903b58f86beaf72a', 'c130d4a1cbb642c0b7fc079969f2d6fd', 'c709e0508ab94b139f42d19e7f0dcb53', '2142035ff0ff419f81fed8875fccf577']"
walk forward away from pool room second on right at between massage next cloth,Walk forward away from the pool and and enter the room that is second on the right. Stop at the between the massage beds next to the checkered cloth. ,"['1a9eaf7e67c444ffbec01b999b40c5a2', 'a5d7dd600de549a0a7c626f8c2c6c3e3', 'e2d51e6321224b5aae0a84c8a90c2dd2', 'bd624a2988bf4a94839472180cc1b3d5', '458b288354be4060a2e6cf582d959d0f']"
bedroom right in hallway attic in middle of room,Leave the bedroom and take a right in the hallway. Enter the attic and stop in the middle of the room. ,"['93318cd6a48a4eb59eb59d2481095044', 'c9da6aab1a6c4447975c5099ce158f75', '1679b5de39e548d38ba240f2fd99cae9', 'f8a73e17d842414a8fea443765cdc1be', '8180c5785c2b43b9933c6493c1e16520']"
walk past bed in front of hammock,"Walk straight past the bed, and stop in front of the hammock. ","['35b41dcbfcf84f96878f6ca28c70e5af', '3e3839eafbd8467993527dffed63a8f7', 'b6aff1ec4dd447c0ab21f2a6bf52e592', 'f1a43d69cfc04812b3099e08fc27d56c', 'ab5c93de69a745bbb1ec09e3c4f2c0ae', 'e57c3575f3674cc782b1155b1de1d110']"
straight room turn stairs on left steps top,Go straight to exit the room. Turn left and go up the stairs on the left. Wait three steps to the top. ,"['a9def3677c5d4397a2c12d2876b71254', '071418244e994a8284a535fc136de090', '935b3ea73b7a40cba6b0964f6d1fd9e7', '6e7445ceeb244238b3162f7fa478bb6a', '63a2a4cb2cba477bba0ad596573efbf9', '76dd8d8a97814d16b3f5401888e7c1e1', 'f2bd01837bb04271a6ec99c31ea850ba']"
enter house wait at couch inside door house,"Enter the house, wait at the couch inside the door to the house. ","['4302a20936e042a2946fc1d82062bf80', 'e34b9715471b421aba635bfc00dfb4a2', '1e1cd1f1f6cd45689fb43615d2ee4eb0', '34f75b755f7d498399a2edfe9fa67faf', '722c4e53817f48e2aff7099315376b15', '23b907de91124aa2893d467659eac406']"
turn degrees down hallway turn right into entryway stand in big circle in front of doors restaurant,Turn around 180 degrees walk down the hallway turn right into the entryway and stand in the big circle in front of the doors to the restaurant. ,"['462cd36ba0ff43b7af69994cc7e2384f', 'cde4845dbdcd439b988ffa3ab38262d1', '8e489f8b8bc5448b9410a41faa216021', '1f6913d742e04627b35d285907b0c41c', 'b3fdc3c598324cc5bbaf8c704c03a8bf', '171278a4cf64429d9ab2df21adcc60d8']"
turn around past table wait in front of large double doors at end of table,Turn around and walk past the table. Wait in front of the large double doors at the end of the table. ,"['76869bdceadf4abf9d834fc7c9bbf2f5', '37ff2e51c319423fb5ea58a67b13f388', '74e7d3ed76fe40b8a0d2ea19aaf4196c', '630f0ee6e8db4d518e31d932d2c5ea4c', '8b22751d94034268b26b9960c1d28e4e']"
walk out of room straight across hall right at stairs down stairs at bottom of stairs,Walk out of the room and straight across the hall. Turn right at the stairs and walk down the stairs. Stop at the bottom of the stairs. ,"['8180c5785c2b43b9933c6493c1e16520', '2efa083bb8244ab2b8a16d135144e491', '92fb09a83f8949619b9dc5bda2855456', 'b6c62c6714d44a7080c83ec374607bcb', '4291cbfde1024467b1548934653f07ce', 'b6dea13e3e414d718e5977ae827651ca', 'cd200cef3d824df19eadb99c5224e733']"
walk past ottoman on left up stairs wait on step directly above ottoman on floor,Walk past the ottoman on the left. Walk up stairs. Wait on the step directly above the ottoman on the floor. ,"['b0ed9edb0520444da200f5f5c1f92e4c', '3b67353ba5e64feeb33884037fa14ce6', 'f97419bd62f6462fbbf8fb8adc4dea29', '951cc0dd0e75482fafe85cec96376fb0', '261b527d225d4fcf85f580f3b304ae36']"
walk end of hall into bedroom wait by kitchenette,"Walk to the end of the hall, into the bedroom and wait by the kitchenette. ","['67dd134230034fc18ab8c30abd9af183', 'cc896d0984cc4661bff9087a0df6967c', '73f8049b6198422aa5f2edfc71fe423b', '76ba074e4b7a46feb3d829302db3bd2e', '7cdc2565c773401289b95360da22e017']"
walk out of kitchen near pie into hall before stairs into first door in doorway of restroom,"Walk out of the kitchen near the pie plates. Turn into the hall before the stairs, and go into the first door, looking in the doorway of the restroom. ","['f3f7c08ceaa64682a96a827a607d94d3', 'b809f8b358634337aef6494a807e10fe', '0c40bcfcf14c4768aa87a8fdf2f8ae45', 'c22786321d024820b6800a975ae81d12', '91735b09a0a14b168c3a12913e9d4127', '5b951c3db95148eb8fb7963165f14e8f', '464db122735c4f57a6c65dbe429b1510']"
walk out of bedroom straight into room ahead once doorway,"Walk out of the bedroom, and go straight. Go into the room straight ahead. Stop once you pass the doorway. ","['7316bf706e0d46368334c0c989210e09', '0226db0c3fd24410bbf3db5e6d4b24fe', 'bad24c9d90de493eb70e9af8383ee598', '6cd8366dfa39465fb61693361c81e8e3', 'cc15fb105d86466faafdd633f89148de', '2c16cbd610cf4e1b92b2830f51c07e32', 'd7044641458e49b0803e186bd1856994']"
head past bed toward chair ottoman right in bathroom at foot of tub,Head past the bed toward the chair and ottoman.  Turn right and stop in the bathroom at the foot of the tub. ,"['239a6c22079a4668bd1df0fb3720c962', '5718221ad03f453b957caddfa136a2f9', '9023e810675e4d209d14bbae08584441', 'eec9cd2d844a420ab80e267ca56bea81', '662330a779bc48eea0e0ab7c6eed8cf3']"
enter house right across room up steps next,"Enter house and turn right, walk across room, up steps and stop next to piano. ","['0ef35d84418446f5a6afb03294742914', 'b218a220bbed4a1eb63ec9941fc58942', 'dc524a4004ae4faaaf8e4978f7ad7897', '3a092061063d41c5b5e54e692341c62e', '119a529d3eef42ef898fbee6ca019866']"
turn around way past bar walking straight once next doorway right,Turn around and walk all the way past the bar and keep walking straight. Stop once you reach the next doorway to your right. ,"['833cde4efe134469852ef36cd6205711', '2b94e839f10648ca8721a0c8c6da121b', '7bfd840693034959a2dffb2625026980', '7ee437db8a914c6d8ce7555b3ce6aae4', 'a475d54e18664630b19f47575a874cf4']"
turn bedroom out of bedroom right wait at entrance of exercise room,Turn left and enter the bedroom. Walk out of the bedroom and turn right. Wait at the entrance of the exercise room. ,"['ef1d1f1bcbb84b0b8242a4c7cef97909', '7478c47d6145458d80f89cee31d70fdf', 'b18be3157a6f4b9c8df154f8f310099d', '929158cc8c424c099a601a36e0fc2270', 'fff5e96c0ba6429f86d5d8b3a74df5e2', 'c897acc78a8e4555b14b85fc32d41f3e', '56783c12f5104ec8b2e6debdddc710be']"
turn bedroom into hallway hallway end turn first white door on right,Turn around and exit the bedroom into the hallway. Go down the hallway to the end and turn left. Enter the first white door on your right and stop. ,"['74ba19593c6343f8bdfffa8c062de530', 'bf5d29d3d97a47a8aaa1a6d0e981644c', 'c313e18d8f404a86b7d80b2845334ff5', '97e2b380b56147da8ec1044227eb11d6', '59fe136fc3e141c2b9c55378d1b39f1e', '624b17d75c344a0e8122c7b0c6858dce']"
turn right bathroom then right down hall until next room wait next cabinet,Turn right and exit the bathroom.  Then turn right and walk down the hall until you enter the next room. Wait next to the cabinet. ,"['dcced7b92f444b9a83bd7d54413fa486', '0d869621d664448497fe76df6d978b44', '625eb179629b45f280c01d3f6ec74b4f', '584c7c4b1e5a4b2aa4f6c0457d8336e8', '39b5e84bdb7e43159a90345cf2d92d77', '52f778d6d86945b5b1fa5e9d763329f2', '151812f86ba842afac3c1778a479610d']"
walk out of laundry room right into kitchen right straight wait by left side of kitchen table,Walk out of the laundry room and turn right. Walk into the kitchen and turn right. Go straight and wait by the left side of the kitchen table. ,"['ceae9606b23d4b31a157923b09655baa', 'e5440b494f3d483d91d857f8eb126b1d', '9186192bc71b4e868af5b35244643ca4', '5791a80c086b44a7a4e868d22fc374cc', '74ce15df381c460a8be6fac9709c6a58', 'd509ae119b9f44daa01672e8e84a8e18', 'a73871837379498eb16527c6b9c9aa20']"
long hall with rug pictures on side right into bedroom bathroom door wait there,Go down a long hall with a rug and pictures on either side. Go right into a bedroom and keep going to the bathroom door. Wait there. ,"['15224ab8675346808c6cb06f06fcaddf', '4c328fadee7746aaa3bc81984c4bce68', 'f51948f5b87546778b9800960f09f87b', '892384f1c7bb45fa8c24eb2fa583ebb4', '121b432a4b374b57b1590408240c7544']"
enter living area right stairs down stairs wait in doorway of bathroom just ahead,Enter the living area and take a right to walk down the stairs. Walk down the stairs. Wait in the doorway of the bathroom just ahead. ,"['40440ed0b1934fbb85929b08bff680e9', '574e933cea2f4e4b9338beb2ad27f64e', '00e1ca9383af4c7ba86241fdeeb73819', 'dc24c0e57e874e40a3ece84d23c012e2', '8e9f6d822fb04edd9c2217d223af3f9d', '1ec7b02628964cedb052c29579e6d404', 'e1823aaa30044d89a3251b46974f410d']"
bathroom bedroom left in hall laundry room through first door on right in front of sink,Leave the bathroom and the bedroom. Take a left in the hall. Enter the laundry room through the first door on the right. Stop in front of the sink. ,"['df9d294a3f8849f6ab267f658847f700', 'cf7c2bd80f934238aede140bb9bd1284', '4cf4c84ed4ae48b2b4076fb0e742d5f1', '31ae672c4fda4ce29add4798d07ce3b1', '29f8bc9c86e94a3692ec50fbad2e7204', 'efa99d80f5024c999633851f5875c6c7', '6a3fba49106e4a9fb40cd0bf47dd4d46']"
head past white couch into hall through kitchen stop by polka dot chair,Head past the white couch and into the hall.  Go through the kitchen and stop by the polka dot chair. ,"['6993d4826f644c37b5632edde130ab67', '310ded38502647188e97b980b77c2472', '42ea9388a1f74f0c84105ba33fab13dd', 'c8ce61375bc8403691ec503de5401235', '8c874344710140e681d78c046d471afc', 'd218377018e14219a034d3bcf992d9a1', 'bd0a6c4865d74589a65cedb040ffcf00']"
exit utility closet steps on left garage wait on stairs left,"Exit the utility closet and go up the steps on the left. Exit the garage, and wait on the stairs to the left. ","['b634b67520bf4c579f044a8e433b021d', 'a5adbda8c1314346a5dc10d9e0f3f908', 'cc507e886ab449b8980fcde8de54b4e1', '8a2aeda8632c4fb38e51733e873ae813', '4d53b2df82b3494a80822eba94c31f2f', '64303f8d3b624128929cd6451d0db37b']"
exit bedroom hall turn at counter right of grey couch,"Exit the bedroom and go down the hall, turn left at the counter, go to the right of the grey couch. ","['b59ade97c6674c23ba6c98612611bfe9', '3ca0a0e34b9046d58a1c3fe2543576e0', '6811d52593b740cb9047202ce1e8a1e4', '92b354c34ef04db58d7df4a754253ac4', 'c51baa7dc99849c4934d01a94a268c23', 'a0538fdc778f4a90ba3b0ef0f40d5caa', 'f5d15314913f4453aca1219437398794']"
past tv steps turn into hallway wait there,Go past the tv and go up the steps. Turn left and go into the hallway. Wait there. ,"['23bfa2960b1f43e7b2213cae51f869f4', '686627fc70a24aa4bea6512db41b7362', '9276c9a3c8964936a1250f7ebd7edbbf', '3aa2bb32a50049de842d066eff185b66', '86231c45c6ac4672bd9c478bd0341335']"
walk out of bedroom past tub table once outside room toward dining table once onto tile,"Walk out of the bedroom past the tub and table.  Once outside the room, walk toward the dining table but stop once you step onto the tile. ","['ff5537fd1daf4f13abf85e6dda34aba5', '65b7fe76c12f44f1b67c5ad7b03ba63b', '30d053d37e614dd999a93cb5c5f41533', 'a5ed9e39260e4273b0cdbda78d3f917d', '4914bb5db5db465dbba150bcb124bcf9']"
room right at corner on banister that in near corner with drum,Leave the room and take a right. Stop at the corner on the banister that in near the corner with the drum. ,"['90f5e6e359b949fdaabf8ac3ee50a82d', 'ef12b1ecc3be4693b327e30468697a9b', 'efcb9e4c410841ca8665f6cab94e943b', '5c4627e7805347bc8c09ba17aa248696', 'f9ea869fc8a04b05bef902bed791696d']"
out of bathroom through hallway into first door on right just inside bedroom,"Go out of the bathroom, straight through the hallway, go into the first door on the right and wait just inside the bedroom. ","['addb4d69f82243fb9a38c4d615651ba7', '0d869621d664448497fe76df6d978b44', 'b8e48c0381644e26bee60d15b8afb47e', '3532b1e7ea1646848b710936d4696a5d', '53672af2c15047818f2ead24a2370930', 'a3aef3290dd544e7bc7d60c9015b031a', '34a370fe2d1840e196a491db1e995e16']"
up stairs sharp turn into hallway walk past bathroom right into bedroom stop,Walk up the stairs and make a sharp turn left into the hallway. Walk past the bathroom and to the right into the bedroom and stop. ,"['c742bd01328e48a0acc256a1ce2a48fc', '282d98c53101421f9df5e0aed5d356a3', '2e99c4517678406c935d5c8bb25942c8', 'c10178a834d7433f8294a88b74d71954', 'f0bf7f3b529548a5a2c36fcc9b05b714', '175d0c8d6d7244f5bbeb03190345cb68', '3d0ecd8a8a6f4ba2b3849f2b77083438']"
turn head upstairs continue stairs top stop wait,"Turn around and head upstairs.  Continue going up the stairs.  When you get to the top, stop and wait. ","['e94cd6b986b5456990723fa8d9612759', '0d24c66abcef47fa898d9c239e6a3de9', 'aa6ef1806b414e5ab49db9a45595c8cc', '564ec6d404cb4349a21a05e0b4bc5fc8', '2468abd2ba7b4e8a9222d3e318c6ad7f', 'bace700b94f743d1bedc82b611604dee']"
walk through doorway head right along railing before drum set,Walk through doorway. Head right along the railing. Stop before the drum set. ,"['a4457a8d962f4a93b82214b4ad5ef9ef', '90f5e6e359b949fdaabf8ac3ee50a82d', 'ef12b1ecc3be4693b327e30468697a9b', 'efcb9e4c410841ca8665f6cab94e943b', '5c4627e7805347bc8c09ba17aa248696', 'f9ea869fc8a04b05bef902bed791696d', 'a102630f0cb84c32abc75f27b7712424']"
walk forward in front of next open door ahead,"Walk forward, and stand in front of the next open door straight ahead. ","['bc497ec23cba4e7b9630cf20f5a73b03', '09e4e508dfb542bb86651bf77d36a64e', '60434c00433b4438912eebe9bd2c6984', '241fde907a674d6ca8916fd2beec6dfc', 'dbef8aac0198493597e8e5aec0de17cb']"
right of piano little hallway stop wait in kitchen,Go right of the piano to the little hallway. Stop and wait when you're in the kitchen. ,"['e28465d6ef394d3f8a0c02650d36a0aa', '6a5926e814994b8ea018963b8d020eee', '1a3116dfd5b24accafbed175eeb376d9', 'bc13627aa65040738b1d971e11162023', 'a8fdaa0e5d5b4588b3fc15e7194227a3']"
cross corridor hallway wait inside bridal room,Cross the corridor and go down the hallway. Wait inside the bridal room. ,"['41aaadfecbfb4c61b9810937212d2ebf', 'd1732bbf32ad4cf096975da88e5b2cfb', 'ffd2d7780984422f8e1f8f6f79ea89af', '17be6f4e233546548c6c03fef0459044', '35b3d70f47994598aedb510108752797', '1948f7cff5b04572b43c105a61df7a6d', 'd08536af13b44cf486b3d906d76cfaf8']"
turn towards red furniture right outside before hot tub,Turn around and go towards the red furniture. Go right and go outside. Stop before the hot tub. ,"['37cb64e0cddc4f20b309abc4ff5344c2', '4890b24fbb59414892ca854895896126', '98f2fab16dc44b82aef16383127ee674', 'fef2e4d985b549a4964fe7790b4aea77', 'a9a28cd4e91b4bc389e476fedba66069']"
walk towards glass conference room stand by black highback chair next desk with potted plant,"Walk towards the glass enclosed conference room.  Stand by the black, highback chair next to the desk with the potted plant. ","['cff2c62e83724edda036bbe481bf181b', '456873879af44c6a90ca9b2c9dcbb0f0', '60e9c84ab617491594f5c2950cc6f3ee', 'cdf8c27ef42e466d90f49aca714a048b', '3ced7afb8c244ddebbf8e9f8eaacb949']"
walk towards green lounge chairs pool wait at bottom of steps,Walk towards green lounge chairs and swimming pool.  Wait at bottom of steps. ,"['138252ad9fab4ae1a86997fc363e6ac7', '87e7b6f2006541a9abe57fba18294a0c', '8078fc4f547a4a9cb1a6bb036cc18dc9', 'cb070d66db084a79b553310df69ed31d', 'b8f49ffb1486488bbb72693578c17865', '094836afff5e4fbfbb6659a96ec665b8', '981311e64aec4d3f8e403f349363e065']"
head towards door in white hallway enter room wait here,Head towards the door in the white hallway.  Enter room.  Wait here. ,"['53a82d3ca3004b1083ffaa2f378dd0e5', '98adaae2e097459da98a6bfc3cf42cc4', 'b8eb71f5698942739b74fff7dfd5ea32', '497341f6deb9491d8069654da6166366', '9dbe2b1ec9484d4da2cd10f502449c72']"
through walk-in closet wait by abstract painting,You should walk through the walk-in closet and wait by the abstract painting. ,"['74ab065a407340d2a67a66e54d64d309', '8fcfcd2540414736b7d56cf70c62ecf9', '3c62d0c1ef944520aa557378c7234b25', 'fea379edc55640b6863f138b527f33c7', 'd3b6b42577fc4c9ea6bb46a8cc9f729c']"
walk under chandelier up marble steps in between base of red staircases,Walk under the chandelier and up the marble steps.  Stop in between the base of the two red staircases. ,"['f8a5d4f68a4f49dd83688e863efeddff', 'ba5080db55e84e4f9a9c02a4549e7448', '20d4286c35fa46a2b4f0db5fb1ff8d86', '3f75b2d4af4d4afd85666d4c1302008c', '813bb8880cdf4a24b48d97af1b4443a2']"
enter bedroom walk over closet,Enter the bedroom and walk over to the closet. ,"['f50dc2ed4dd34dd1942c3c2600c2da50', '5bc66b50e1374ca7a49ca01316891481', 'e8564d8248ba46fbac60fae0e93bad4f', 'acdc9f9be3f64c04a5cc75e768eea67b', '683b92657e2c4900b6e760760aac7057']"
bathroom through laundry room into kitchen on left in kitchen next cabinets with books on,Leave the bathroom and go through the laundry room into the kitchen on the left. In the kitchen stop next to the cabinets with the books on it. ,"['565e3e860daa4b9fa39e79bc38c4b65b', '1eac2c379ebf4e059f4a35e584f82f9b', 'c24e5838cd5a434e88b1209cb375bfeb', '9a2945c3ffdf4dc6aa8ff34e0ad42c0b', '6ab11272308c46068c9ae583da8ff311']"
stairs turn at pool stairs on third step from bottom,Go down the stairs and turn left at the pool.  Go up the the stairs and stop on the third step from the bottom. ,"['5c1275543c164a4f9bc60b08d8cb5c43', 'c92b9bd8b885423b8d6d1a7a58d2ca2c', '1349a908694c4494999f72c36e52e1bf', 'ec6d76b6f8ef4cdbb8311d1546249b81', 'ce9ce6a7a34b4bfb8405e6009ed85783', 'e6040538e6ec43a7b73be5b9614ebd68', '9940d688fe8f4fb784cd7d64908fdf4d']"
walk past pool table straight until hallway on left hallway wait there,Walk past the pool table. Go straight until you get to the hallway on the left. Turn left to the hallway and wait there. ,"['b29274ad819d4011aab6f538373d0ee1', 'a25a1fe848e044a99a0033878cd108bb', '114842471cc14a44b2f284c943281413', '4ebc0f4d023c482ca72e8129ca042c13', '83404d7a12fc4749bf0cfff1e1e07987']"
down stairs turn right down stairs right at first doorway stop,"walk down the stairs, turn right, walk down stairs and turn right, turn left at first doorway and stop. ","['34812a1a581b4f6490268057007f2e1a', '37f71f4c278d46e0a4a664b3e189ec8e', 'e8725e08bc3a496b8d791ca2f3bbeae2', '1841abbee0e04435a3fbd7db05df30b0', '0c171ecf9f6a46828c74e9088cf0c34a']"
