src,tgt,path
head through doorway into area with large table first arched pathway on left into study/library stop,Head straight through the doorway into the area with the large table. Enter the first arched pathway on the left into the study/library and stop. ,"['c1a600332bb245b19d8174c0790d6fd6', '9c36a2928f3d436181736d628dd0a694', '59163d8ecd3a41038c79bad8d0b51d7e', '262ffaa0bb8a409ebf26df9e9f2f5146', 'a5f4055ab7134ffcbbe8b33150552301', 'af9ff2224e1d4b7babae5c082ebba917', 'b1265fece0604be79853a0ce270d7c45']"
exit room right hallway in middle of hall,Exit the room to your right and continue down the hallway. Stop in the middle of the hall. ,"['da58370d41bc428caf503fc3edd33be2', '56a2256d20f844eeb81066e35ccb5449', '9a58a33f622546f2b08fdea686675826', '70a57ddcd42148c2973c2cf0c2f454d8', 'f62d25bc9cbd41d3acb0b60301ae4955', 'caf815b583284834a7a07526e93de4e5']"
bedroom right step in doorway of empty room there,Leave the bedroom and turn right.  Step in the doorway of the empty room and stop there. ,"['743e6d37beae4b6482a43ae41e634e67', '27869fb0e3414f2687b9580b335ec615', '8f25ebb1c23d4fddb035eb336426d5fa', '7cae5e5f8adf444d829c95b4a4412ffd', 'cad74e94fdeb425a860ae16cc0fdd45a']"
walk past small trunk into hallway on left through hallway into bathroom on left just inside bathroom door,Walk past the small trunk and into the hallway on the left. Walk through the hallway and into the bathroom on the left. Stop just inside the bathroom door. ,"['64f15fc5001f42a58ad17839e7dc6c8c', 'b09e4d4c48154b58914cf98dc3d8983a', 'b2f31140a9d0482096da4ac481fb8a56', '4262bd54789f4caf839be008248e4d90', 'cc9907d0bebb4c78938322ea577af7cf', '39274e52c0404a0a85a1705133468817', '13f2aa8423ca4c5588d50631355707c0']"
turn around past long table chairs turn at end of table wait there before other doors/rooms,Turn around and walk past the long table and chairs.  Turn left at the end of the table and wait there before entering other doors/rooms. ,"['6adb624995514635831f42da9156fec2', '94ac3cea52ec455993f8562f78da3be1', '1df9b813b2744cedb516e9bf02f1c805', '1c8c2e9847f44e33a5bb2115058a55fc', 'f31f9af9f3134580b5faae0de45aba28', '35202b9ad8d64ce3ad53193ee0ca1f73']"
bedroom through door on right towards kitchen wait,"Leave the bedroom, walk through the door on the right, walk towards the kitchen, and wait. ","['eb74eebca6c646808946749065633047', 'eef89e7a055443d8825cf94f092aaa35', '70f4a1eb60744999ba4a1f63fef62afe', '7cb2c4bc9ad84463b4d0c6a91b8c4640', '9d001c6bc0f64a699fd36a6b9a61266a', '8138835f78064c28b6c9c35a89eda7d6', '177f67f4e2264d24996672f84cd38405']"
hallway right once doorway at end,Go down the hallway to the right and stop once you reach the doorway at the end. ,"['21fca0d6192940e580587fe317440f56', 'a7f591c0bf5443a8989e6adf9968cf90', 'a0a40af004954a90b2b24a0cc6655881', '24e8ebf554d742069e81afd7eb3369c7', '4214a9b1607e4cbea8dcdb42a4952796', '6127ee658ce64bf48765bf59bbead503', 'db8d7c22a6764639ab807ec3dec69a8b']"
exit room right steps wait there,Exit the room. Turn right and go up the steps. Wait there. ,"['071ca188c1b7423c947607cc794e9f72', '7f5f4e3055ed47648524fc475bafda6f', '6a500a9a43a340eb817c58bb084327fe', '8b3817a237a54b89ac363dbea46b39c9', 'dbd4b155e5b24f279efe34ffd8c172a8', 'b0aa89cc447b4aab98f0b50b5c76b3f8']"
up stairs at second step from top,Walk up the stairs. Stop at the second step from the top. ,"['69fad7dd177847dbabf69e8fb7c00ddf', '55e4436f528c4bf09e4550079c572f7b', '3c6a35e15ada4b649990d6568cce8bd9', '397403366d784caf804d741f32fd68b9', 'c23f26401359426982d11ca494ee739b']"
stairs into kitchen between window kitchen island chair closest fridge,"Go up the stairs, into the kitchen, and stop between the window and the kitchen island chair closest to the fridge. ","['397403366d784caf804d741f32fd68b9', 'c23f26401359426982d11ca494ee739b', '29fb3c58b29348558d36a9f9440a1379', '6d11ca4d41e04bb1a725c2223c36b2aa', '4bd82c990a6548a994daa97c8f52db06', 'b27908161ec6419eb6bb5313178d59e7']"
turn past stairs hallway then bathroom on right wait by sink,Turn left and walk past the stairs heading down the hallway.  Then enter the bathroom on your right. Wait by the sink. ,"['feb3e37459f942f98d53eb78d66375f5', '118169c7cc3f488e88a237f10cad437b', '4069c437611e44c69edf8175de76b201', 'e1ac54fab83242b889a95320811c68e5', '95a4b136cb854ea585cb23d67e174cb3', 'badf87714efc482f936c14de653318e5', '675491e4cc5a459db65fba26b03e6369']"
turn right left into bathroom in hall near stairs,Turn right and turn left and go into the bathroom. Stop in the hall near the stairs. ,"['3892d409b66644439f5afcf3d296efbf', '78485dd696e24574a37f81dea58c5f4f', 'ddc9afa8e031453abd45c783fbfeb4aa', '031a6316a244425c8c9a7a43ab6de08d', 'dcbdda428eb846a586886b87d9552d0e', '17ebd8e343c247dd845f76a586f8cf08', 'f3914b4071b7408c843d4d45a7370be2']"
hallway right of white couch open door first set of stairs,Follow the hallway to the right of the white couch. Enter the open door and go down the first set of stairs. ,"['ad6d632f2967414abfcc9aedbc12c1cb', 'ba47fad63d3945a4ba9ce229b8382d56', 'd77a892c6e734158b4e2a3622ee3d814', 'de2b6398072949d6a2d97e5fce3355c7', '80dd66bb7de64313ae768e259fcc260f', '2deb77ca0f7f48eda4e0cd89728199f3']"
exit office into hallway on left turn wait in bedroom at end of hallway,Exit the office and into the hallway on the left. Turn left and wait in the bedroom at the end of the hallway. ,"['4304b16fd7b744ec8cd9277d0adcb4da', 'd90dea9462374ee08a44f35e4505926e', 'b6018ae2d13248f7a12edbf31f70b04d', '7921c216294d43c0b7be2ca634bbf6a9', '818d69716786445f8eef89a590ec3f52', '92ffe9fa9ea6437c88eac23b0bafc0bc']"
turn around towards wooden cabinet at cabinet right past table stop at doorway left,"Turn around and walk towards the wooden cabinet. At the cabinet, turn right and walk past the table and stop at the 2nd doorway to your left. ","['b618cd7f70bd430a9af0e0770738cb41', '0907c60c53f7431aaedabbf388069a7f', 'c3a25551d0e74186ab736e502f621f9e', '7025038ba12d4a63a40c866489226fbe', 'a9366b89465a49028782a840a165a7e8']"
from here then right side near upstairs,Go out from here. Then take right side near upstairs. ,"['ce23b2b514f449a0b334dc15146fc14f', '7e78414b83ee4a378dfdcc91c052be65', 'b31ae8536d72434ea33243b17fc0dee0', 'f97419bd62f6462fbbf8fb8adc4dea29', '3b67353ba5e64feeb33884037fa14ce6', 'b0ed9edb0520444da200f5f5c1f92e4c']"
forward through door past stairs right closet wait on other side of door,"Go forward through the door and move past the stairs. Turn right, enter the closet and wait on the other side of the door. ","['dec940911e0a44e7b51b8fa218fb3550', 'fefbf5f40d364b0fb096d1d93aba4316', '81829ab350054bf297a7ebbb1eb4fcee', 'a2131c9b8e674c3db73821fb924f1644', 'cd289dfb2a4d4161ab18c8b0e7889f0d', '5260f113c5f542a8b6b115cbdfc9fef5', '6dbb762da390463f83fc26b02e723259']"
walk forward kitchen walk past counter area on right at end of counter,Walk forward to the kitchen. Walk past the counter and go to the sitting area on the right. Stop at the end of the counter. ,"['c305c2e9304047b2a87bd1e56ce01b55', '2f9f9138696447ce8cf3d64be4339a4f', '452f930d3b20485088ca14b716189512', 'fe7d2c6830bd45f680b43a6a5298d218', 'c2ccfcbf74824095965c81c64f15081e', '91b2405dc77f4ea7941586109ab53e7f']"
walk past kitchen into dining area wait by window at other end of table,Walk past the kitchen into the dining area. Wait by the window at the other end of the table. ,"['4bfddda1a6d940a69c20ad1117dcd3e1', '3d6cd6d157704b8abe96332301d16436', 'eaa924cd93794010a866d09389edd172', 'cadc13ee1b3e4b04b720062aa5f765fb', 'd218377018e14219a034d3bcf992d9a1', 'e91fd405eae74dcb93ab7036937b1c60', '1a4cc7154b1a4e44b8b41f6f6bb7a235']"
walk through doors past bed right before black stairs,Walk through the doors and past the bed. Stop right before the black stairs. ,"['cf1e2fed4ab24fe4818c1a92c8567786', '234597e72c5f4c79a88e94ccc7979b4a', 'e0dc27df8b2d4484bde0f97284d4cdf7', '285b697fed754f86a09602c93628cfb4', '4fe4474e9bf9429ea92d202bdea4dce5', 'f923d8ec1f32400c864837ba572fe199']"
walk forward past hot tub on path towards doors in front of door on right before house,Walk forward past the hot tub and stay on the path towards the doors. Stop in front of the door on the right before you enter the house. ,"['9b66262361814acda74fb9444039622c', '5f70dea238aa4c8eb85954cd768c55fc', 'f74428d06fa34b79bcfccb38f448e2c8', '615acadbd02d4570b997e6021233996a', 'd2a62238e6a8472381a0111b06f35f72']"
walk through doorway right hallway right after exit sign,"Walk through doorway, take a right down the hallway, stop right after the exit sign. ","['69be720ef7d542f0ae989a5d7284a9f5', '9a171506cfa84aaf8423148db313595b', '6059bb4895c44f61b181a695404de5b9', '62598b562a764478bc79f602a231f27b', 'dc9ce6f3581e4697a60eaace16a05696']"
turn patio towards front door front door then ahead at base of stairwell,"Turn and go down the patio towards the front door. Enter the front door then continue ahead, stopping at the base of the stairwell. ","['13e2611f096647158384c2186def62cf', '595344b8d6a7471691be526b8b9d685f', '0acbbb92572f437faef8da9b991412f6', '35aade4482c04c1385cbb19c25bd1d7e', '41873d3929e64a9a938a5fac3b6bbd79', '61aa57f78ebf40dd9bc04e27b1a4c80f']"
walk through kitchen right after column stairs bathroom wait near toilet,"Walk through the kitchen, turn right after the column. Proceed pass the stairs and enter the bathroom. Wait near the toilet. ","['efd3219352b14aacab0e688b9e1e37c1', '0d26a7b757344916b0da6b8ae83ea5ba', 'a61fb920752a42b59d68f5f6255102c2', '2c3072d2aac44e00b64acaf42eab3b8d', 'eba4808d933f4e03b96b9285cf70c5fb', '235a5906e4fc4d3ebc87db8177330652']"
walk through only doorway in room then through doorway on right once between doorway toilet in room,"Walk through the only doorway in the room, then walk through the doorway on your right. Stop once you are between the doorway and the toilet in the room. ","['16bd2ace3edc47449caca63e656bce1b', 'ef12b1ecc3be4693b327e30468697a9b', 'efcb9e4c410841ca8665f6cab94e943b', '5c4627e7805347bc8c09ba17aa248696', '1430dc4987e248a7a9ec03ca89714127']"
dining room main lobby towards main entry at entry doors,"Leave dining room to main lobby, walk towards main entry. Stop at entry doors. ","['3d91ffc84e224406b42082370fa5ea03', '41aaadfecbfb4c61b9810937212d2ebf', 'd1732bbf32ad4cf096975da88e5b2cfb', 'ffd2d7780984422f8e1f8f6f79ea89af', '17be6f4e233546548c6c03fef0459044', '35b3d70f47994598aedb510108752797', '1948f7cff5b04572b43c105a61df7a6d']"
walk past stairs then wait at entrance,Walk past the stairs and then turn left. Wait at the entrance. ,"['ed79b51efdac434cb12bcd3d5e7fd112', '4214a9b1607e4cbea8dcdb42a4952796', '24e8ebf554d742069e81afd7eb3369c7', 'a0a40af004954a90b2b24a0cc6655881', 'a7f591c0bf5443a8989e6adf9968cf90', '21fca0d6192940e580587fe317440f56']"
exit bedroom turn corridor stop before fireplace wait there,Exit the bedroom and turn left Follow the corridor and stop before reaching the fireplace. Wait there. ,"['eeb46aee1c014c8b99009457a45838e6', '3d6254ee55de4e4b997c64bd06d78af7', 'd3038501401941f8afe4e9e2df5eda73', '732ae10002fe4de0a6f62864391cdf11', 'a0aeade23ab74a5f93544047c19718e8']"
walk through columns forward towards area in front of table with large candlesticks,Walk through the two columns. Walked forward towards the roped off area. Stop in front of the table with the two large candlesticks. ,"['97e40a397edf4dfbae3894c998508284', '3e18ef6d21744a9f884a6b148c0d63ac', '502ebb6c5a214d6394d2bb294d7e2886', '91b89c02a03d48c891bee19a49350f8c', '67e8a588a25d4a808d523bc54bec8483', '4f54063fb8464b8ca7e08147f2a4ec3e', '9ef6399314c94a93abeec2d6054f4658']"
indoors walk towards tv walk through door left of tv inside bathroom by door,Go indoors and walk towards the TV.  Walk through the door to the left of the TV. Stop inside the bathroom by the door. ,"['875061238dd04a2ab9bfaf8d85d6c549', '1bc6dad179a6490691f99433c6e45ff6', 'd0fd62a0342b4cf1ba722c39aca257ce', '9231543c6c484c939a501338ad8c1db4', '4e928c0ff7504619b7c308a354c78f5f', '92b53ec4323443c1a4f64e6722f0e8f1']"
stairs right wait in front of painting on wall,Go up the stairs and turn right. Wait in front of the painting on the wall. ,"['090a8663beeb4ce6aeadfe720ea0c8e9', '4d76fa50a0e743e695fb048b4a7766d5', '35b1214591eb4a43a3f85d63973d43a5', '3b165e9f2f0a4317be49995470e65e02', '2d4f020bd427433288c4b9e12bfdf5a6']"
upstairs few steps forward on floor stop,Go upstairs and take a few steps forward on the floor and stop. ,"['b90801209e564a309883d214b02a6195', 'c742bd01328e48a0acc256a1ce2a48fc', '282d98c53101421f9df5e0aed5d356a3', '2e99c4517678406c935d5c8bb25942c8', 'c10178a834d7433f8294a88b74d71954']"
exit bathroom then at left side door inside room wait beside bed,"exit the bathroom and then at your left side there is a door, go inside that room and wait beside the bed. ","['51b17bc333674eb48d81ea7624118783', '15b25adcf9bb4a0f8c751138a651dd8b', '0fc2263dc29f4a9183320eddd33edb58', 'c9030e71fc29447599a5c21d90261ca5', '4b82c138b8b743479d535513aabfabf4']"
walk towards sofa way upstairs,walk towards the sofa. go all the way upstairs. ,"['b0ed9edb0520444da200f5f5c1f92e4c', '3b67353ba5e64feeb33884037fa14ce6', 'f97419bd62f6462fbbf8fb8adc4dea29', '951cc0dd0e75482fafe85cec96376fb0', '682b19fbab024b3ca81f62cd4d287ca7', 'e4fb260227ff4f5d88c1ccc8e4dd1e75', '3c8b0995c325481a85ad4648931e5fde']"
turn right at stairs wait in entry way of bedroom just ahead,Turn right. Turn left at the stairs. Wait in the entry way of the bedroom just ahead. ,"['f0f377d341c34670bcd9d861d903d747', 'f2e403f149ae451eb8fc5ab27ec96e9f', '2f9f9138696447ce8cf3d64be4339a4f', 'c305c2e9304047b2a87bd1e56ce01b55', 'b04418ba1f3c437f9006e16dfab20c2f', '32eb496edc0d4c42a2ab57fff2512a99']"
walk way across room wait by lounge chair,Walk all the way across the room and wait by the lounge chair. ,"['dea2f4ebec914445afc126de6babe1fa', '0e144a6507864b6795d4001a90cba761', 'fcf3b78d35544555a69e47f346b63e38', '6e58a7a5583847d7be281fc41b86c94b', '5ef3f0f5642a4858a7dbc2c20dc04842', '98ada9cf49e441539d91b3f45839539b']"
across deck through pass way up stairs next first rocking chair,go across deck through pass way and up stairs. Stop next to the first rocking chair. ,"['6db8c50a618a4939be1614dc1c618621', 'c91341f14a4f499e8b45d128091ed087', '9096013c3596463b9c0500520d12fef1', 'e4b0794b87994a7699ad7f6ee501d404', '373c50dfa27649188f8e5b66c28f10a7']"
exit room right through arched doorway at top of side of stairs,Exit the room.  Turn right and go through the arched doorway. Go and stop at the top of the nearest side of the stairs. ,"['5ebc7429c5344395b9849773581b6ebc', '03e418be259e4659bb47e1734b02ec67', '96e014c3d5894319b4155277e04ae637', '1619aa4c11c445d092b43bafb4eaefea', '8db786868c1341709ea8777cb822e063', '5e770c44fdbf44079e0936d2e1aad894', 'bffa1faac5024b19abf8b4150e634c9c']"
walk through door next plant inside room turn once inside into closet stop after into closet,Walk through the door next to the potted plant and walk inside the room.  Turn left once inside and go into the closet.  Stop after stepping into the closet. ,"['5c4627e7805347bc8c09ba17aa248696', '42135c66aa4d464aa8a91630c187ed99', '7e23cbe5e28047d49ab4641f530c9f00', 'bead484602044dd9b9f855148864ee99', 'dea81734bad44c9389a908251f9b70d0']"
down corridor wait through double doors dining room,Walk down the corridor and wait through the double doors to the dining room. ,"['cb7d4a315dc446459a9bb060475ea9a1', '8ed24114308b42b6ab1ddebf3b3a6541', '01b9c25e9cc946f6a7a53688577e2fc3', 'd1732bbf32ad4cf096975da88e5b2cfb', '41aaadfecbfb4c61b9810937212d2ebf']"
walk across large room on right across artifact room enter large door on right between doors,"Walk across large room to door on right, walk across artifact room and enter large door on the right. Stop between two doors. ","['216c427533564466bcb81b7d8082dd8c', 'b9a94cf38df045f38b32c07c6fb26376', 'c2e3d3b973294b91bb895469e6fbbb83', '7292b16bfe1540b8bcc46d523b14b241', '8ae030e5a5504a7eac1269be9eafe6f3', '21d98b3051984309af072f3fde91c49d']"
turn around out of bedroom right right wait in bedroom,Turn around and walk out of the bedroom and take a right. Take another right and wait in that bedroom. ,"['76228b7929e042119bcefc90a85fe8d6', 'e82e3f859f25463c8b9505111de68b78', '54ec02d8e3b34bb98f816214688ee85c', 'b814285591cc43f799874da54f847a54', '9b9d929b88994a0eaf69501c2cab3444', '3fc59e198b3c42c5a7f5c5b2bce5e18c', '5832fa0c60c9437b88f5d4caea1ee610']"
turn straight past stairs hallway into last door on right wait at entrance,Turn left and go straight past the stairs. Continue down the hallway and go into the last door on the right. Wait at the entrance. ,"['3d21f7b1843f4b4c9037b7ed0942dd6b', 'ecbf5fbd21624d5d872b17609b6616d9', 'd1de344c27c544be87d6705a81aeb732', '9a99ebf7c9e947229e4546d8b30040b9', 'f3d04dad3ca84d0c91d16f4d8970bb50', '34ff274015304d918c694178cd41efcd']"
exit bathroom turn left towards area past dining table wait near wall with light switches on left,Exit the bathroom and turn left. Turn left towards the dining area. Walk past the dining table. Wait near the wall with the light switches on your left. ,"['942331a24b5f46239caa4219a905e349', '86231c45c6ac4672bd9c478bd0341335', '3aa2bb32a50049de842d066eff185b66', 'c06aae190b804b759496db0b88fe4820', 'c3c5e202b9a04a63ae33742fe9095936', '859a7c9c12c847d9a6860bd6d6bd635a']"
turn right stairs turn right stairs turn hall wait between doorways,"Turn right, go up the stairs, turn right, go up the stairs, turn left, go down the hall and wait between the two doorways. ","['0aa7d38c4a904859b548bd69f4691106', 'd5dbd24d1b9c404a9b4fc687ecf17a4f', 'fa51cb2051f240d795737cdffeda6178', '12c934ed973740efbdbe207ab3a064d3', 'e40675d8209d426e8f60cdd315953cab', '7bf81bd8601e4bde87ef2365f625288c']"
walk right living room forward polka dots outside door there,"Walk and turn right. Enter the living room. Walk forward passing both the polka dots sofa. Walk outside the door, and stop there. ","['5fc192b8dd7b496db4925aaa16f60821', '8c874344710140e681d78c046d471afc', 'd218377018e14219a034d3bcf992d9a1', 'bd0a6c4865d74589a65cedb040ffcf00', '95d84f2a4d334b9589b00bd2ee8c41d5', '43b624e2a1a54c758490afea3cb8ff59', '8f6e247cade44925bd3406f4590e24ae']"
down ramp right stairs wait on fifth step from bottom of stairs,Walk down the ramp and make a right to go down the stairs. Wait on the fifth step from the bottom of the stairs. ,"['140ee525d84c4e6e9d0b3bda3cbc19ab', 'f0bf7f3b529548a5a2c36fcc9b05b714', 'c10178a834d7433f8294a88b74d71954', '2e99c4517678406c935d5c8bb25942c8', '282d98c53101421f9df5e0aed5d356a3', 'c742bd01328e48a0acc256a1ce2a48fc']"
walk straight then after room turn door outside wait there,Walk straight and then after you exit the room turn left and use the door to go outside. Wait there. ,"['bed1e142845343c5b9695eabad5d170e', '5ee3f3c0dac54a1893594c1fde6a427a', '88fda52a9c9e4a5cb1774e741ecce8f6', 'ca77dd4132f044b7b6b999d3795d09d3', '9a896fadb819490089bf51005088f464', '6b0783db762e4593ab5ff5fa7caf57ce']"
up stairs towards area wait near bottom of spiral stair case,"Walk up the stairs, walk towards the sitting area, and wait near the bottom of the spiral stair case. ","['739e48ca68834cf8891a90fc3c5bde9e', 'ebb265bc44bf4bc78621b09ab4771b8a', 'a87349504ff94c868c92181ad897e7be', '3d865f821f0c4627b23b835858c76647', '10edf51d497643788b3a583f72af03e7', '2bcf4fb2ce434ef3a24cb3c8c0fc4357']"
walk past stair on left past vent above doorway right.wait at closed leaded glass door on right,Walk past the stair railing on the left. Walk past the vent above the doorway to the right.Wait at the closed leaded glass door on the right. ,"['8d43b24343ac45c3bc8a68937908699f', '7303cbe7993b4005b102b3d950ab5cc9', '64fa4996e32f46769853bc37640a97c3', '00862e7575f6408ba95204f85ee7f3da', '912e008205b74654bdcc87040f5f4c6e']"
exit bedroom hallway straight on right degrees on top of staircase,exit bedroom to hallway. Follow hallway straight to stairs on your right. Turn 180 degrees and stop on top of staircase. ,"['0672a86275c14b148e8618ecde714e06', '837b0a58fa8b4820a3c07e0c89ccfc60', 'b5b07238f2f94494b5d16390855584cb', '1c2209fa44fc48c7b7ce7981bafc4ccf', 'f1b191033043441987b8ebf1bb55002c']"
into room with large blue rug round tables in middle stand outside doorway left of stairs,Go into the room with the large blue rug and two round tables in the middle. Go stand outside the doorway to the left of the stairs. ,"['994e59a2e5cb469eb29c7ff68c6d49c2', 'bde29f48ab814943baf4a7193d143d6e', '12142264f293430ebc8092e16b47cba0', '1ba7d881e867480585d80c1222f54028', '975241bb74e744ed97b658a04f189d47', '6acea2b64c694b948f50da07d88ed31e', '099839b0911a409787e237301c90e418']"
turn right past couch through doorway down stairs into kitchen stop,Turn right. Walk past couch through doorway. Walk down stairs into kitchen and stop. ,"['60e9c84ab617491594f5c2950cc6f3ee', '77b24e884d9f47599994c1ade95f0b89', 'caada625c5b4460da34bd695539db791', '5bef72c3da8d49e4b62a50234fe97cb3', '718e7b8d4f63458d951d734b777c4562', '8ae0426af8824849ba75a6147325c30c']"
straight exit room right hall then,"Go straight and exit room. Turn right, go down hall, then turn left. ","['152b7ad4b471410a8557ce5fc2c9147a', '450b5325b5bf48f0a8076bb973b42fdf', 'fd4752f551d04e22be492adea0d9fb04', '9ee37c1bce0a41e8bd50821540e80713', 'af5f1942b4374015823bd32e31b31c64']"
long brown table with chairs left side of bathtub,Go to the long brown table with two chairs. Go to the left side of the bathtub. ,"['f8aed080cca34f1cae4c902c6824975e', 'b01bbec805a345ee8e1ab9df2af011fe', 'acafa24b747d432bb80c1d045b7177ed', '36e6935d948843a8a292782b2919291b', '35202b9ad8d64ce3ad53193ee0ca1f73']"
spiral staircase way right walk double doors at open double doors,Walk down spiral staircase to entry way. Turn right and walk to double doors. Stop at open double doors to patio. ,"['a8f4d86fe29043e3b6eee87bd8612432', '8761de5366b14140bb6c5b3ee12d1f3b', '42aed91e9ec84f9ea89f86c49db984e5', '084c9684a25a4c4f8cdea7afa21d6851', 'ad048e19d6cc41d2b559988b26aea08a', 'c948e0adde424b22af74a18d3cf14ee6', '5269c77b79004d35b83ff2ec0b92dcd8']"
walk out of room past glass shelf turn left into bathroom by wicker basket,Walk out of the room past the glass shelf and turn left. Turn left and walk into the bathroom. Stop by the wicker basket. ,"['2cb036ad9c594172abd2a9bc9d3d9159', 'e14074a6c7e0450492bf4c0a6c431357', '6ea742331ac84fb9ae24a1b8d76bcf8a', '7dcc99131ec74b968cb9d728c49220e0', 'ae2a7dc3c3e545b98e2fcb374de658d1', 'f45d421d04e34220b2aaf9246b6dcdd1', '82cb4105387a4ab5a09d82d7ff02a41c']"
walk past bathroom right stairs wait at pears,Walk past bathroom. Make right down stairs. Wait at pears. ,"['ec0421cc61c64f6f8692d327d6838fd5', '02253cded39e4f26a34c483d645ebcb7', 'fa065de5315940abb64684e68f6d686a', '9940d688fe8f4fb784cd7d64908fdf4d', 'd8cb55a17c6e42c785e62d5cdd27a21f']"
exit bathroom immediate right stairs at top,"Exit the bathroom, take an immediate right and go up the stairs, stopping at the top. ","['58aeb039d7dd4fa4b26e70e77df07938', 'db0e4e7b77c04948b581a11f633df145', 'a33fe858085149e8908942d0bf98767f', '96490c4da78240058d1f76a07ed95c9d', '68e4c4477aa442cbbb9a9f1e54b9b831', 'f1b191033043441987b8ebf1bb55002c']"
bathroom right into bedroom walk through bedroom into bathroom in front of sink,Leave the bathroom and take a right into the bedroom. Walk through the bedroom into the bathroom and stop in front of the sink. ,"['24d10bcad3b84d3a942f76fc34c2b210', '7cb2c4bc9ad84463b4d0c6a91b8c4640', '70f4a1eb60744999ba4a1f63fef62afe', 'eef89e7a055443d8825cf94f092aaa35', '395d4594592e423ea7a0e1618dd384aa']"
turn flight of stairs at bottom out into hallway wait by doorway next dirty poster,"Turn around and go down the flight of stairs. At the bottom, step out into the hallway and wait by the doorway next to the Dirty Dancing poster. ","['8f9f3441c9714b36ae836fb9c0f8427e', 'c23f26401359426982d11ca494ee739b', '397403366d784caf804d741f32fd68b9', '3c6a35e15ada4b649990d6568cce8bd9', '55e4436f528c4bf09e4550079c572f7b', 'c629c7f1cf6f47a78c45a8ae9ff82247']"
walk toward fireplace right once room with fireplace building onto patio once doors,"Walk toward the fireplace. Take a right once you enter the room with the fireplace. Exit the building, and go onto the patio. Stop once you pass the doors. ","['1948f7cff5b04572b43c105a61df7a6d', '35b3d70f47994598aedb510108752797', '17be6f4e233546548c6c03fef0459044', 'a2e6626d7a7e4c7297e0609c92aa7945', 'd1de08c84e9e4f42a0acaeee738df23a', '99dc41ba4676449d8fc37890a38ad9e3']"
walk past dining table refrigerator turn left after through archway in front of closet,Walk past the dining table and refrigerator and turn left after going through the archway.  Stop in front of the closet. ,"['491b9b2d5e63400f9b448e5603dd05ae', '1b48df86b7a149fa8e90161265def866', 'ca75317572dc44509427cf7b2caecda6', '410b3939a8c24ab8858782fa544d704d', 'cc356636fdbf45769882f5912bc6d009']"
walk through living room past tv on wall on left into hall stop between tall green plants,"Walk through the living room, past the TV on the wall on your left. Continue into the hall and stop between the two tall green plants. ","['da03259fb98d42f2a9b67f29399dc0cd', 'f21573f2d2f244fd9e176c94f75b063f', '0163f2c462ed46a08eb3dbce625c9a9d', 'dc69d1d9957248c0a29e8044c49989e3', 'af73d4fc48ee4f6f95f8b66b640785a5', '624b17d75c344a0e8122c7b0c6858dce', '59fe136fc3e141c2b9c55378d1b39f1e']"
walk forward down hallway bedroom at end of hallway once doors,Walk forward down the hallway. Enter the bedroom at the end of the hallway. Stop once you pass the doors. ,"['9d691cb5fdfc46d995836e1ea82465d7', '88ffbea957e34cd09d0ce2d3290e9694', 'b1a1885860a54b8cb99c6f4ac19999a5', 'f15cd6746d1f4b7a804ede38d47cfa03', '5fdff4b578f24ff98a213299f3d91576', '696ce593a39d47ef9acf6902ee134861', 'd1af2f90794243db807d60a07050941c']"
closet right left in hallway library area once room,"Leave the closet and take a right. Take a left in the hallway, and enter the library area. Stop once you enter the room. ","['942b118a4bc64ec898ed9c6fd4b85edb', '4262bd54789f4caf839be008248e4d90', 'b2f31140a9d0482096da4ac481fb8a56', 'b09e4d4c48154b58914cf98dc3d8983a', '4bc28cee06d54af9aef263db6f9f2016', '8e9d71e0515e46d6a9b0d2e8dd1a50fc', '9376619fe9f04b57afe602afe554c680']"
