src,tgt,path
room into next room once in other room straight into next room wait at entrance,Leave the room into the next room. Once in the other room go straight into the next room and wait at the entrance. ,"['f7dfad43a3a6462cb96145242bd8bdd0', '6cff8d4e873a4dbc8db352872e706bb8', '09f015ea8ca94df8841bcea7030bca99', 'beaaf39947ee40f7822ed8a383bf6472', '2287f7e926a7402a8723eaf0db683d09', 'f461fdc9b5c54386bcb1350bf4072015', 'c9030e71fc29447599a5c21d90261ca5']"
stairs right in door past exercise bike,Go up the stairs. Take a right and stop in the door past the exercise bike. ,"['1527831f765e40c1b5210e52248427f7', '5965958b0a55454d88d45f21d97bc3fc', '63333423642f49caac4871521e93cc45', 'be1a38f2bec74de79395d0a938234d38', '164618f724c64b43934cb95b11c89593']"
walk landing then at front of glass door,walk straight the landing then stop at the front of the glass door. ,"['b15db460058c41e8aa0c0720344daa30', '298a2386166a43c8a04e1c24433f7d15', '9fed9031c0ea482f914d07abfb59970b', 'd38c4ae95f5b4640a2696b923b80d1f4', '9c19aeb19e6e4ad98b2a31cc44b9aa7a']"
forward toward grey couch at foot of stairs few steps arrive at base of curve,Walk forward toward the grey couch at the foot of the stairs. Go up a few steps and arrive at the base of the curve. ,"['dd500133846248c1b24eea995d7dee4a', '2287f7e926a7402a8723eaf0db683d09', '28a8a22473e342f7be7ed0f33e4272e3', 'fa30e6859ca249a78879975b0b659bfb', '0896e14268a54c1faa6a5648eb8eb63b', '959878d8792948b5888684622f4eca36']"
steps then slightly right wait near desk,Go up the steps then turn slightly right and wait near the desk. ,"['44e14ff2fcd34fa9a93265e53dc53b52', '3d409564a59c44ea84fd79ddc8aa4fc9', '7b99836e3e0045f2b5cc212e8181914b', '8ae0426af8824849ba75a6147325c30c', 'e48486bb391449b2becb28faf44e515a', '3ced7afb8c244ddebbf8e9f8eaacb949']"
statue bottom of stairs room on left first white chair,Go to the statue. Go to the bottom of the stairs. Enter the room on the left. Go to the first white chair. ,"['d0ab03fe8b9d441bb6cbd0621903bd0d', 'c05ffc986dd04970aeb52d5b15a20ad4', 'ce72b075950f44ecbf6f44abd6106e08', '7d9e8e6508884b1c8c9fedf59d70729e', '81a50ecde0ab42cd81e0cf23a2529675', 'f745a3bf638a40dd85e29ce98d8c2aba', '913aefa5733c425eb79de9f5e225cd0e']"
exit room door on far right there,Exit the room using the door on the far right and wait there. ,"['1880ed0a5e3144739cd5fcaacf3b4dfd', '40bd5db3c01e445d903b58f86beaf72a', 'c130d4a1cbb642c0b7fc079969f2d6fd', 'c709e0508ab94b139f42d19e7f0dcb53', 'a96b308a64c147fabbfbbf4916afb091']"
down lobby around reception desk in room next desk,Walk down the lobby and around the reception desk. Stop in the room next to the desk. ,"['3c9f696ecbb241cd9fece54ce1b07369', '10b397282f864df3968aa92727d990f7', 'e5e1301c040f4617b2e9512bc4fb1c78', '74b06bb5be1945f99ceacd2687aaa74f', '2bf2e4eb6fbd490b95540647ecb4f708', '5fb9a0b5b9794fb290f15e050d81d5bb']"
stairs on right walk through hallway right into bathroom wait near sink,Go up the stairs on the right. Walk straight through the hallway. Turn right and go into the bathroom. Wait near the sink. ,"['23ed105b1f0f48bbb6ec025df9d313e7', '14f2a8bc76f24d2ea495369bfde2f653', '780f24f51de04a70bd30129c8ab9913e', '6c4fa6dfddc1499db228854454bfc61d', '28cd285e6d5545dda080d949bb00f1c0', '9ec5ebcf3edc44e1ba6dd02e8423e5ed']"
turn around through bedroom towards bathroom just inside bathroom,Turn around and walk through the bedroom towards the bathroom. Stop just inside the bathroom. ,"['3145063a8bd64299952a6a2812fa039f', '3a1c1e9d72cc4a0689941f6086cba5e3', '820774305e6f432ea789534d9cda5671', '279aa7019bd34bba990d425da5166638', 'ffacb35a54514b50933640577802d946']"
exit office through double doors first right in hall into bathroom next sink,Exit the office through the double doors. Take the first right in the hall. Go into the bathroom and stand next to the sink. ,"['88fe76c2969d431caf5d60ff7aa5467a', 'd1ffe5280fce4ac5a949cdc9ee8b6f7c', 'ecff9ecf0cfe4d8bb83260fc092f3b00', '28c09c307b11487c999f88e1e9ec3231', 'f4939bf6f00a4864832a358f1ea8394e']"
straight then right stairs twelve steps then,Go straight then go right and go down the stairs. Go down twelve steps then stop. ,"['7bf81bd8601e4bde87ef2365f625288c', 'e40675d8209d426e8f60cdd315953cab', '12c934ed973740efbdbe207ab3a064d3', 'fa51cb2051f240d795737cdffeda6178', 'd5dbd24d1b9c404a9b4fc687ecf17a4f', '0aa7d38c4a904859b548bd69f4691106']"
walk past pool patio table head inside head towards small set of stairs wait there,Walk past the pool and patio table and head inside.  Head towards the small set of stairs and wait there. ,"['78f4fd1a913946059be779b7507870b3', '8b675c426b5f4d7ca4ef9000da426789', 'de07efde6cf54bc28fd6f33b7cffe069', '0cef156ab53041da97dd6a70d3d5af0b', 'a92caa72325040bea8093cd576dd9a8d', '0e7a7b8f99a84a719128d3d0982e9b59', '36a2419151544f299c99cc0f247b2bb2']"
walk around pool table through door in middle of hallway on other side just after mini-theatre,Walk around the pool table and through the door in the middle of the hallway on the other side.  Stop just after entering the mini-theatre. ,"['d4fba379bcee4c53bf62282ec8aded53', '9922aafc4ca442db9ff9aac3b0fd5b34', 'b8eb71f5698942739b74fff7dfd5ea32', '497341f6deb9491d8069654da6166366', '9dbe2b1ec9484d4da2cd10f502449c72']"
walk straight right hall into third room on right,Walk straight and turn right down the hall. Turn into the third room on the right. ,"['fa8f8dca1b784036b54e4f3ea26bbdbb', '02e18ec4d4f94d2eb4407346c822dee2', 'e52609aae11f42a79f6cf50360180fd5', '8c414a8052c844b4bcd5dc3fadde7f8c', 'e5567bd5fa2d4fde8a6b9f15e3274a7e', '5252c175323b4df68d458d98ed00b9bc']"
walk around front of bed doorway through there just inside hall way,Walk around the front of the bed and to the doorway go through there and wait just inside the hall way. ,"['a001f94d840e4acf869b3a1f3c3774f6', '9e594d4805b94a40a8dec94fc0a1cd06', '2a3fd29ff11348719ff3f94d0f3eca6c', 'c9783668a5784d83bdafb4003b81e7fa', 'db6b51d7a53940ddbe44a55d4ba067d7']"
walk past air hockey table on left wait at futon,Walk past the air hockey table on the left. Wait at the futon. ,"['416d35ec584141e093766986f1b74144', 'c9c9dd651f25409c915f962a60efb7fb', 'b8bb3aadfe61498bbaab510af3a999ac', '87533ca2d23b444ab0f7da5d7a4c17b4', '4e9aca10b4f142a48cde60ca007e614d']"
exit door turn forward bed at door bathroom outside bathroom door,"Exit the door, and turn left. Walk forward passing the bed, and turn left at the door leading to the bathroom. Stop outside the bathroom door. ","['8a3f2a5d30b847b7ae94eb24d5d9c8e5', '0608309a14594ef9ac53c26b9e03a1ae', 'd1af2f90794243db807d60a07050941c', '505ca3ca13414b7884dd6332040ca52c', 'ab2d0f38b21e4493a632fd5aa8ef99a8']"
exit room then right hallway steps then right head toward round table wait by round table,Exit the room then turn right and head down the hallway. Go down the steps then turn right and head toward the round table. Wait by the round table. ,"['67c20b163349417893a145ea7a3f1cd7', 'e642c08656284353abdd1fe071ad1582', 'c9de4124b5664e17b2de92e43314390f', 'b2841aff8c1d4b4fae73a440cb628aa4', 'c5bd22ef651543849baceac1a199192b', 'c948e0adde424b22af74a18d3cf14ee6', 'ad048e19d6cc41d2b559988b26aea08a']"
walk straight inside slightly near pink couch,Walk straight and go inside. Turn slightly left and wait near the pink couch. ,"['0ab3970074fb418da34405440e01093e', 'a42b0b5c27b347b1bac3ed3e145785ba', '156af10f63d84956ba5dc4b9fe3b2140', '0a709d588fcd4ae5badd921366074d7a', '7a920bf869fd41099e44a0829f818361', 'e1d49f9c53bf45ae98d0dd8fb613161a']"
head toward stairs fireplace then stairs then straight until door into room wait at entrance,"Head toward the stairs, pass the fireplace then the stairs then continue straight until you get to a door that leads into the room. Wait at the entrance. ","['12e9fa5962de43698cf9cec57105d287', '9766d89c21094c5b872be3a378d4cbad', '0e8e2c9d09974dab977c1d3868286f12', 'c69af2f0e57b485886e0f4667b2209a5', '70d67ed19aa34e34845d32ca74a1d711', '22f85dac33524c6889f80fa7e76a6790', 'be8ffeba688d499b982fa36b58f0cef1']"
walk through open door into first room on left walk staircase on right there,Walk through the open door and go into the first room on your left.  Walk to the staircase on your right. Wait there. ,"['38478098d7cd42cb9623326d2696a65d', '9ccf363f5cee403b91fd038d8e3a78dc', '949a6c58781d4e80bff19ca32493efcd', '32c98b5cfe804dd185a8cb6ecb91a63f', '448d573c3160494c8715d3e7314f4afb', '63333423642f49caac4871521e93cc45']"
exit bedroom turn bathroom on right wait there,Exit the bedroom and turn left. Enter the bathroom on the right and wait there. ,"['e3b5cbc0554e476a8f17d4797b993d7a', 'df428e69750340cdb9612ca81d9b098b', 'e1ac54fab83242b889a95320811c68e5', '95a4b136cb854ea585cb23d67e174cb3', 'badf87714efc482f936c14de653318e5', '675491e4cc5a459db65fba26b03e6369']"
turn through doorway right in front of sink,Turn around and go through the doorway and take a right. Stop in front of the sink. ,"['498ad4add3424a4eaf28355ded64c622', '96d3ea8a25b347e4b097f070a1cba15e', '7dcc99131ec74b968cb9d728c49220e0', 'e6e19fd376c544b58035a32bd44ed8d4', '4ed50a2f86384de599f06df862d17b10', 'c5fe339f452f4eddb9659f812c38c748']"
turn right right again stairs on left steps then,Turn right. Turn right again. Go down the stairs on the left. Go down seven steps then stop. ,"['bad24c9d90de493eb70e9af8383ee598', '6cd8366dfa39465fb61693361c81e8e3', 'add739ed237b4b1ab540290617cdb30d', 'c688725841444971ab4788b382c60643', '2d20ebd11b9d4855bac237d15181e126', 'a74b9199d22447118e506cfa169638e3']"
exit bedroom walk past office on right up stairs.walk across wait near framed landscape photos,Exit the bedroom. Walk past the office on the right. Walk up stairs.Walk across landing. Wait near eight framed landscape photos. ,"['7cdc2565c773401289b95360da22e017', '76ba074e4b7a46feb3d829302db3bd2e', '73f8049b6198422aa5f2edfc71fe423b', 'cc896d0984cc4661bff9087a0df6967c', '5a72c23b99fa40f1bcd9dfbb60340b05', '6c34dde402304953a9416e2781de607f', '1239dba1b6234964b420a56d82d79d7a']"
if bedroom with striped blanket on large empty closet directly across from,If you would go to the bedroom with the striped blanket on it you will find a large empty closet located directly across from it. ,"['36932f17cd6f4351ac3a9efd6632e0c9', 'e1ff49c1e5114971af1f3f6df0c155b2', 'efe92e05c7f044dfb7cfc92e3cb2f2b9', 'dcbc89b871b54cdd98d8b59b700d44a3', 'ba3d3163aa4a4211a0bda0b7adf07b60', 'eb3774d7d7c9470ca3ef2727c4cb58a7', '76ca01da5d454acab14017ac9b27ba76']"
turn lamp on left straight into room wait by washer,Turn left. Pass the lamp on the left and go straight into the room. Wait by the washer. ,"['9bf70d9f93b9443c89b19bfd9503a56a', '7b708eb6eca54256976220baf01508de', '050910e36ac9414c91bb44d962153689', 'bff52b252a464909ad342ea7eb971750', 'ab178a6f3b0940878d38744498df88bf']"
down stairs veer right into hallway at bottom of stairs next black bench on right,Walk down the stairs and veer right. Go into the hallway at the bottom of the stairs and stop next to the black bench on your right. ,"['ed79b51efdac434cb12bcd3d5e7fd112', '82e8acfab99d4441ac4da5bf22c2642d', '8836420cacbe4c37a57a8f8645da320b', '041c71a6b7364371892021424389107a', '19e0d074a48044949855917a5bff42ad', '6be22e287d2f4bb4a5fd1fc1172d438b']"
walk towards red rope,walk towards the red rope. ,"['26dedb23c6e949dcbc1aa47b70653ef3', '03f6e7e5c26b45d78feb5c2e3b6601e3', '807009de2d6c43bf857a9250dc76f8be', '56cf724d00bd469c8c4b80ad9ffa68dd', '3f75b2d4af4d4afd85666d4c1302008c']"
exit bathroom turn left through hallway right,Exit the bathroom and turn left. Go through the hallway and turn right to stop. ,"['6fbfaa4207454c288739caceb9512fb5', '90ec6d25cc584b50ad6c56ec683eeb6b', '584c7c4b1e5a4b2aa4f6c0457d8336e8', '625eb179629b45f280c01d3f6ec74b4f', 'b8e48c0381644e26bee60d15b8afb47e', '3532b1e7ea1646848b710936d4696a5d']"
pass between couch stairs continue into hall right through door before cheetah wall hanging,"pass between couch and stairs continue into hall.  Turn right and pass through door, stop before cheetah wall hanging. ","['b75981f465ee4e9cb88d8ffa92a8d5ba', '0c55a4a0877b46459d81c35ffeaa34c0', '522362613f6341389177c0c259455f38', 'd9a69bc7b8a54a319a05f366120ef056', '0e5f1cd9a1cf46ecb2280d75dbb0a819', '5c092cee3b7c4684955a2827c06b87e1']"
steps past table chairs then right steps then there,Go up the steps. Go past the table and chairs then U turn right. Go down the steps then wait there. ,"['187589bb7d4644f2943079fb949c0be9', '64565f72062245da87430cc31dd383d9', '9167f8d20b954ccf97b09d33762cf4d5', '4cac488dae6a442289ce32fd0b6a42fe', '8e1fa462cea64696aa723bbfbdb1b21e', '6ab39d830183407cb7ec17206889000d', '74d5b2290be74a1ba052b6fe2320e064']"
staircase at bottom left near doorway,Descend the staircase. At the bottom take a left and stop near the doorway. ,"['159bf39081724055a73e686a6577096b', '6c34dde402304953a9416e2781de607f', '5a72c23b99fa40f1bcd9dfbb60340b05', 'cc896d0984cc4661bff9087a0df6967c', '67dd134230034fc18ab8c30abd9af183', '20f6b7fcb5254024aacdd907da2eb315', '7d1e000e54d942168b24155d12cd265b']"
hallway right left at intersection in hallway once left,Go down the hallway to your right. Take a left at the intersection in the hallway. Stop once you take the left. ,"['aa7cc0aa8e064354997d0433a82dc806', '993e201c128c4114a4e8ff6d74786f86', 'f341f09fde4149acaf9d05e10ce73481', '05007a3d6dc2420b960c6dcc2e9b0353', '881a405088944173a5494c9e5145677c', 'be7c88ff81f04b52b18125c6c9f4b84f']"
head hallway mirror then wait by last door in hallway,"Head straight down the hallway, pass a mirror then wait by the last door in the hallway. ","['b2f2e0367c764b9b8b236ff6fe73f19c', '328ef7c3d2ed4da7a2e2af2f27735c10', 'e428c761024a458e8b052494cf6249f5', 'c8d856118813486e9c9b263afb5b38a7', 'fff5e96c0ba6429f86d5d8b3a74df5e2', 'c897acc78a8e4555b14b85fc32d41f3e']"
into living room navigate behind couch left forward at end of hall,"Go into the living room, navigate behind the couch to the left, move forward, stop at the end of the hall. ","['f2f26d64c3144e57bc867f213ddb8ef5', 'cd34b75acbf5486bba1630b63870a345', '0c55a4a0877b46459d81c35ffeaa34c0', '522362613f6341389177c0c259455f38', '21d840b73bd84f65a97d2577b9a7cc6c']"
turn degrees stairs top of stairway right forward few steps then,Turn around 180 degrees and go up the stairs to the top of the stairway.  Turn right.  Move forward a few steps and then stop. ,"['52d0bc7591a34dae8557db931cfabca6', '2440860450f140fe93cac6c281f89af8', '4592c86e6f7a467aaddcf03cdff7a2ad', '70fe6e3a6efc4b71b835cdd4c29d4a68', 'c166cb16a3134e1b8d8ab37ffae7ae49']"
walk through bathroom right walk past couch table chairs behind chairs,"Walk through the bathroom and turn right. Walk left past the couch, table, and chairs. Stop behind the chairs. ","['4256db7f41e440f9a4d097079c53d560', '4b69f27bd8c84260b8d455f5711e8647', '2336065dc5eb45d5a6807c94cf3072cd', '767338ad85174714a86e1e60a866a829', 'd35571d078954f8d89dcc1c79d91674c', '418fb1f91e9543aab0c4205a90ce217d', 'd3c1b1ed115c4034be5946179563ff22']"
head inside right forward into bathroom wait near bathtub,"Head inside, turn right, walk forward into the bathroom, wait near the bathtub. ","['4d36794543214b2a80738a74a9929dc4', 'bbe77cfe6824428fb8400849ebcb2584', 'c823eb7138474e9d9fb2026a01ef7a8c', '3a1c1e9d72cc4a0689941f6086cba5e3', '820774305e6f432ea789534d9cda5671', '279aa7019bd34bba990d425da5166638', 'ffacb35a54514b50933640577802d946']"
stone walkway towards glass doorway right into glass doorway wait,Walk down stone walkway towards glass doorway. Turn right into glass doorway and wait. ,"['9b66262361814acda74fb9444039622c', '5f70dea238aa4c8eb85954cd768c55fc', 'f74428d06fa34b79bcfccb38f448e2c8', '615acadbd02d4570b997e6021233996a', 'f1c9fadd26764ee48670b32571ce9c39', '48a174fdebfc429c9d5cca4e74d7fbdd']"
walk into hallway right way down stairs.make right at room entrance,Walk into the hallway. Make a right and walk all the way down the stairs.Make a right at the room entrance. ,"['5d5aa3fb8039496b9930c0ca09d277c2', '5117df51d5b64847980813ed0519f031', '15db0029a9844a5c8f8aadefe7178d10', '8fd980702db14e348e93943d61fdfb9a', '9a477352c0364b76839862c7298bfb8e', 'd2875e02333d4dd991e866786a87c1be', 'e85f9caa15a64aebb9e9138395a457d9']"
other side of library stand on red dot blue dots,Go to the other side of the library and stand on the red dot. Follow the blue dots. ,"['cf726b6c0144425282245b34fc4efdca', '84291807bc3a4c9ea9f5d7f7ef53704c', 'c4e9e99398d84df5bf0150c484ebcd01', '7515999894aa42ffa9ce63c8cabe246c', '4c793e5198034f3eb52a199745373fb8']"
turn right walk through curtain walk across bedroom exit bedroom through doorway on right wait by towels,Turn right walk through the curtain. Walk across the bedroom and exit the bedroom. Go through the doorway on your right and wait by the towels. ,"['3103ac3f8af84b21baa815a539ef2d1f', '547c469228044c6999ce9384bd83a1b7', '14f795852b794fd79f8867eb631fb873', 'c130d4a1cbb642c0b7fc079969f2d6fd', '4ed0dc66de83415196cb59d120b71d55', 'ef22fd41921142d4a36d6354d2e10d23', '700e564b1a6f4ae2a7a230639c9f2b7f']"
stairs then after slight left into kitchen then,Go down the stairs and then after take a slight left and go into the kitchen then stop. ,"['564ec6d404cb4349a21a05e0b4bc5fc8', 'aa6ef1806b414e5ab49db9a45595c8cc', '0d24c66abcef47fa898d9c239e6a3de9', 'e94cd6b986b5456990723fa8d9612759', 'c1be688e07c845d194fa8c32d6327968']"
walk from cigar case across room enter hand side stop between urinals sinks,Walk from cigar case across room to restrooms. Enter left hand side and stop between urinals and sinks. ,"['17be6f4e233546548c6c03fef0459044', 'ccfc7026f4c6494ca251076c85aa906c', 'fa1f118c0f924788aa7ea44f690a054f', '06c88433ed80477f90bd50f8dc25e7de', '77cfb227d30443428d4c7787a3da713c', '16c5a8f68e1242889dcb3854090c7a86', '050e4a7ef017477499ad9595e3e2a812']"
exit men bathroom ladies bathroom wait there,Exit the men's bathroom. Enter the ladies bathroom and wait there. ,"['16a0cba0f2b449279095e9676005a3b9', '050e4a7ef017477499ad9595e3e2a812', '16c5a8f68e1242889dcb3854090c7a86', '77cfb227d30443428d4c7787a3da713c', '06c88433ed80477f90bd50f8dc25e7de', '64d3b2030ff44be8b25729c7658dde17']"
exit room through middle double doors across room first door on left continue through hallway stop on rug inside door,Exit room through the middle double doors.  Walk across room and take the first door on the left. Continue straight through hallway stop on rug inside door. ,"['0026d80fc3c84d91bd088b831d230738', 'fadac209cfc04129998323d048a5c908', 'f5bef118db5b41849ce63cbfcefed938', '0cb7f98845aa4939a1125d430acb7183', '73de1f780b804c92a2441ac92c442c49', 'b6bcf908137f4b2d83d66e5fe6c35656', 'cfd9511c06b34cd1b89ba36919a4e6b6']"
exit room through open door room on left wait by doorway,Exit the room through the open door.  Enter the room on the left and wait by the doorway. ,"['90f5e6e359b949fdaabf8ac3ee50a82d', 'ef12b1ecc3be4693b327e30468697a9b', 'efcb9e4c410841ca8665f6cab94e943b', '7e23cbe5e28047d49ab4641f530c9f00', 'be5b6e7ec1654cf5bef5d348f9601697']"
stairs then u turn into room ahead turn wait near toilet,Go up the stairs then U turn left. Go  into the room straight ahead. Turn left and wait near the toilet. ,"['f115d708bfd944c7a6bff880581d79f7', '9c4bd27f6372466f904b6ce78045857d', 'cd289dfb2a4d4161ab18c8b0e7889f0d', 'a2131c9b8e674c3db73821fb924f1644', '81829ab350054bf297a7ebbb1eb4fcee', 'fefbf5f40d364b0fb096d1d93aba4316', '8646134295d2446ba7e27db2fd6da710']"
up stairs on right wait,"Walk up the stairs on the right, and wait. ","['b0e48743d80b4fbb9a9c7dfe5e08f49d', '8836420cacbe4c37a57a8f8645da320b', '82e8acfab99d4441ac4da5bf22c2642d', 'ed79b51efdac434cb12bcd3d5e7fd112', '4a2b6fa66ac54acfbae98270236548a6']"
ahead right steps straight stop upon kitchen,Go ahead and turn right to go down the steps. Continue straight and stop upon entering the kitchen. ,"['ce88ee8b7ee84fca92c13ab16599d90e', '4a907cb4383f44ffb221841eac4775a6', '63a61ea85f58452db2c228c737ce2283', '54f59a5c1c4f4de69f48c33e4e4ac5f6', '75f912cc662f46c6884c3dc3a30fd6d3', '97cf79c77dfc45b2ba2f79ead489f21b', 'afb429082cb0421ab1924a1eb314624a']"
up ascending stairs right stairs on stair fourth from top,"Walk up the ascending stairs, and take a right to continue going up the stairs. Stop on the stair that is the fourth from the top. ","['c29e99f090194613b5b11af906c47dab', '5125c4a0a99f45788e694d5a73ba99c7', '20f70ab4efec496c86529075648caef2', '1b321779a4374c2b952c51820daa9e6c', 'd70997cce0464616a65afcf28d32b41e']"
downstairs almost down stairs at level right in grey doorway,"Go downstairs, when your almost down stairs, at the level, turn right and stop in the grey doorway. ","['7fb6b56858c14239a79f65ef01e8691b', '5f8485232eeb4d74af9fdf2894ba058c', 'd70997cce0464616a65afcf28d32b41e', '1b321779a4374c2b952c51820daa9e6c', '20f70ab4efec496c86529075648caef2', '5125c4a0a99f45788e694d5a73ba99c7', '7cd02069ac1546319b95be27fc04d7b5']"
stairs straight hallway wait near sink on right,Go up the stairs. Go straight down the hallway. Wait near the sink on the right. ,"['dc24c0e57e874e40a3ece84d23c012e2', '00e1ca9383af4c7ba86241fdeeb73819', 'ba5d70e6143e45c3a8281157ea9ed905', 'cf179316af9845da991406a02a012674', 'e8baf2b6f92146069db9252267cf8e12']"
exit bedroom right enter door on right,"exit bedroom, turn right, enter door on right. ","['40268bad0e6240a2950ec0b8f46ba5bb', '3942d5496e264f0d806d0707eb365337', '5832fa0c60c9437b88f5d4caea1ee610', '3fc59e198b3c42c5a7f5c5b2bce5e18c', 'c8ecc5b238f143d89d756449616c5798', 'be56a19405c9474786bdce274e3a4733']"
leave tile room right at bathroom sink,"Leave tile room to hallway, turn right and stop at bathroom sink. ","['97db9c9bd9824a3ca623db620331ea66', '3fd2f1d849de4e9f8c07863c845db6b5', 'a8cb8984630b456a96923ef0d7c3aeb3', 'fdf0fc24f7c549ccbb78e972c8024fa9', '0c5658ec8f51460fbf29d6aedcfb4bca']"
down corridor past exit sign past first doors,"Walk down the corridor, past the exit sign and stop past the first doors. ","['61b8ed10e81d46e09e19515659eada92', 'b22d5420f0b54692b01da8e91ba2d92f', '772987c5182047be8aed36730aa1d6e0', '57c701cc1ed74df19cd6c9a754c9baaf', '1fd387a5d80e4d58972490d89edee1fd', '858a873ebc524be8b6c916058c9fcd7e']"
right side of kitchen island stove doorway nearest stove staircase stairs,Go to the right side of the kitchen island. Go to the Stove. Go out the doorway nearest the stove. Go up the staircase four stairs. ,"['2f58ce64fff84016a48b598779720fa1', '2450c6afba784195bf10834c786a1de3', '949b0754cae54aa0936b0ee9e1df149b', 'fb76fb85a5984f3b871b02607a535c8d', 'b28f29d6260f46b6bd9eaa97d787ea53', '4dc03c8cd82e44e7a2a825dc48417f45']"
walk by left of staircase enter bedroom right,"walk by left of staircase, enter bedroom and turn right. ","['dc189857232643f9a17d5760ebb07b02', '1ff35596f9cb4b98ba4f08dda81c1654', '5d711de78dbd400aa4cfd51fc05dfbee', '2f1dd90f66c64ef5bfa5255692e7304a', 'ac03b99e3f3642be80b4d24fde0af03a', 'd88c41884dc24efbb5c1b7dcf97998e9']"
walk out of bedroom up stairs walk past steps into kitchen stop by island,Walk out of the bedroom and up the stairs. Walk past the steps into the kitchen and stop by the island. ,"['4b643a114c19427ba3f1f5b2580f6724', '32eb496edc0d4c42a2ab57fff2512a99', 'b04418ba1f3c437f9006e16dfab20c2f', 'c305c2e9304047b2a87bd1e56ce01b55', '2f9f9138696447ce8cf3d64be4339a4f', '452f930d3b20485088ca14b716189512', 'fe7d2c6830bd45f680b43a6a5298d218']"
straight past couches room double doors on right right wait across zebra painting on left wall,Go straight past the couches. Exit the room using the two double doors on the right. Turn right and wait across the zebra painting on the left wall. ,"['b9da45eba09347cca11a17df78db48f8', 'bdbad33ca8034305ae6bad4b43994068', '126ef6e65677477f826f0b6ddbcab9af', 'cffa1c807d2c4a708aa1e5f42aeba106', 'b09e4d4c48154b58914cf98dc3d8983a']"
pass christmas tree light blue chairs red chairs then other christmas tree turn by large table with chairs,"Pass the Christmas tree, the light blue chairs, and the red chairs then pass the other Christmas tree and turn left and stand by the large table with chairs. ","['8928b554a7004ef9855170e584781f31', '267a7e2459054db7952fc1e3e45e98fa', '59b190857cfe47f691bf0d866f1e5aeb', '150763c717894adc8ccbbbe640fa67ef', 'b411496c1f7b403981f0c2f24995309c']"
through bedroom into area outside on porch,Go through the bedroom and into the sitting area. Wait outside on the porch. ,"['a516beefab4e4a1abeb2165c39c59258', '3545fab034fd4ba8a334f31d6595177a', 'ecd87bf5f6c94ce7b4dfc4c9dbab47a3', 'e57db85f00a9481787bd9c3c98453f27', 'a515a42b3cfa4005affc8b3f14d8ca2d', '6a15f715d61843b2a84845d392ec0b72']"
head into bedroom left through doorway into circle room then right into first doorway step into closet wait,"Head into the bedroom, make a left through the doorway into the circle room and then make a right into the first doorway, step into the closet and wait. ","['929158cc8c424c099a601a36e0fc2270', 'b18be3157a6f4b9c8df154f8f310099d', '7478c47d6145458d80f89cee31d70fdf', 'ef1d1f1bcbb84b0b8242a4c7cef97909', '303468f25f254a04ba109f567acb4340']"
straight then after stairs straight into hallway wait right by painting with small gazebo in garden,Go straight and then after you pass the stairs go straight into the hallway and wait right by the painting with the small gazebo in the garden. ,"['d27baa90a51345e6b2f2c72588dd29a8', 'dd0fda62dc354e1b8fba87b27331dd42', '2067f05c08684509a550a1188522e869', '2665dbb7fe3e4f33811e687cc4054393', '6f9eb2058c134830b45d010c01de8e96']"
walk straight toward house almost until pool wait there at corner of pool,Walk straight toward the house almost until you pass the pool and wait there at the ending corner of the pool. ,"['131ddd8afe144bf9a0d22bdc435f117d', 'c1601686ff1d4d6aa7b01a1cb4bc7e00', 'b1ce0ca7853d4889ad9313a89b8150ac', 'bb06442335d542cbb733939a78fcff36', 'ce55b83aa694421a89a9866dc7c6b7b6']"
